{
  "$schema": "https://json-schema.org/draft/2020-12/schema",
  "$id": "https://videomaker.local/schemas/video-structure.schema.json",
  "title": "VideoStructure",
  "type": "object",
  "required": ["id", "projectId", "sourceVideoId", "version", "metadata", "narrative", "rhythm", "packaging", "slots", "evidence", "confidence"],
  "properties": {
    "id": { "type": "string", "minLength": 1 },
    "projectId": { "type": "string", "minLength": 1 },
    "sourceVideoId": { "type": "string", "minLength": 1 },
    "version": { "type": "string", "minLength": 1 },
    "metadata": {
      "type": "object",
      "required": ["durationSec"],
      "properties": {
        "durationSec": { "type": "number", "minimum": 0 },
        "width": { "type": "integer", "minimum": 1 },
        "height": { "type": "integer", "minimum": 1 },
        "fps": { "type": "number", "minimum": 0 },
        "codec": { "type": "string" },
        "hasAudio": { "type": "boolean" }
      },
      "additionalProperties": false
    },
    "narrative": {
      "type": "object",
      "required": ["summary", "segments"],
      "properties": {
        "summary": { "type": "string" },
        "segments": {
          "type": "array",
          "items": {
            "type": "object",
            "required": ["id", "role", "startSec", "endSec", "scriptSummary", "visualSummary", "intent"],
            "properties": {
              "id": { "type": "string", "minLength": 1 },
              "role": {
                "type": "string",
                "enum": ["hook", "problem", "solution", "proof", "benefit", "comparison", "cta", "transition"]
              },
              "startSec": { "type": "number", "minimum": 0 },
              "endSec": { "type": "number", "minimum": 0 },
              "scriptSummary": { "type": "string" },
              "visualSummary": { "type": "string" },
              "intent": { "type": "string" },
              "transcriptExcerpt": { "type": "string", "maxLength": 120 },
              "rhetoricalDevices": { "type": "array", "items": { "type": "string" } },
              "emotionTone": { "type": "string" },
              "retentionRole": { "type": "string" },
              "voStyle": {
                "type": "object",
                "properties": {
                  "pace": { "type": "string" },
                  "energy": { "type": "string" },
                  "persona": { "type": "string" }
                },
                "additionalProperties": false
              },
              "visualSpec": {
                "type": "object",
                "properties": {
                  "framing": { "type": "string" },
                  "subject": { "type": "string" },
                  "cameraMove": { "type": "string" },
                  "onScreenText": { "type": "array", "items": { "type": "string" } },
                  "colorMood": { "type": "string" },
                  "density": { "type": "string", "enum": ["low", "medium", "high"] }
                },
                "additionalProperties": false
              }
            },
            "additionalProperties": false
          }
        }
      },
      "additionalProperties": false
    },
    "rhythm": {
      "type": "object",
      "required": ["totalDurationSec", "shotCount", "avgShotDurationSec", "tempo", "beatPoints", "shotBoundaries"],
      "properties": {
        "totalDurationSec": { "type": "number", "minimum": 0 },
        "shotCount": { "type": "integer", "minimum": 0 },
        "avgShotDurationSec": { "type": "number", "minimum": 0 },
        "tempo": { "type": "string", "enum": ["slow", "medium", "fast", "mixed"] },
        "climaxSec": { "type": "number", "minimum": 0 },
        "beatPoints": { "type": "array", "items": { "type": "number", "minimum": 0 } },
        "shotBoundaries": {
          "type": "array",
          "items": {
            "type": "object",
            "required": ["startSec", "endSec", "confidence", "changeReason"],
            "properties": {
              "startSec": { "type": "number", "minimum": 0 },
              "endSec": { "type": "number", "minimum": 0 },
              "confidence": { "type": "number", "minimum": 0, "maximum": 1 },
              "changeReason": {
                "type": "string",
                "enum": ["visual_cut", "scene_change", "caption_change", "beat", "unknown"]
              }
            },
            "additionalProperties": false
          }
        }
      },
      "additionalProperties": false
    },
    "packaging": {
      "type": "object",
      "required": ["titleCards", "stickers", "transitions", "visualDensity"],
      "properties": {
        "subtitleStyle": { "type": "object", "additionalProperties": true },
        "titleCards": { "type": "array", "items": { "type": "object", "additionalProperties": true } },
        "stickers": { "type": "array", "items": { "type": "object", "additionalProperties": true } },
        "transitions": { "type": "array", "items": { "type": "object", "additionalProperties": true } },
        "coverStyle": { "type": "object", "additionalProperties": true },
        "visualDensity": { "type": "string", "enum": ["low", "medium", "high"] }
      },
      "additionalProperties": false
    },
    "slots": {
      "type": "array",
      "items": {
        "type": "object",
        "required": ["id", "segmentId", "role", "startSec", "endSec", "requiredAssetType", "visualIntent", "scriptIntent", "importance", "constraints"],
        "properties": {
          "id": { "type": "string", "minLength": 1 },
          "segmentId": { "type": "string", "minLength": 1 },
          "role": {
            "type": "string",
            "enum": ["hook_visual", "hook_text", "product_closeup", "usage_scene", "benefit_card", "comparison", "proof", "transition", "cta"]
          },
          "startSec": { "type": "number", "minimum": 0 },
          "endSec": { "type": "number", "minimum": 0 },
          "requiredAssetType": {
            "type": "array",
            "items": { "type": "string", "enum": ["video", "image", "text", "voiceover", "generated_visual", "packaging"] },
            "minItems": 1
          },
          "visualIntent": { "type": "string" },
          "scriptIntent": { "type": "string" },
          "packagingHint": { "type": "string" },
          "importance": { "type": "string", "enum": ["must_have", "recommended", "optional"] },
          "constraints": { "type": "array", "items": { "type": "object", "additionalProperties": true } },
          "durationSharePct": { "type": "number", "minimum": 0, "maximum": 1 },
          "migrationTemplate": { "type": "string" },
          "packagingRequirements": { "type": "array", "items": { "type": "string" } },
          "antiPatterns": { "type": "array", "items": { "type": "string" } }
        },
        "additionalProperties": false
      }
    },
    "evidence": {
      "type": "array",
      "items": {
        "type": "object",
        "required": ["targetId", "source", "summary", "confidence"],
        "properties": {
          "targetId": { "type": "string", "minLength": 1 },
          "source": { "type": "string", "enum": ["asr", "ocr", "keyframe", "shot_detection", "audio", "llm"] },
          "summary": { "type": "string" },
          "confidence": { "type": "number", "minimum": 0, "maximum": 1 },
          "timeRange": {
            "type": "object",
            "required": ["startSec", "endSec"],
            "properties": {
              "startSec": { "type": "number", "minimum": 0 },
              "endSec": { "type": "number", "minimum": 0 }
            },
            "additionalProperties": false
          },
          "excerpt": { "type": "string" },
          "artifactRef": { "type": "string" }
        },
        "additionalProperties": false
      }
    },
    "analysisQuality": {
      "type": "object",
      "properties": {
        "warnings": { "type": "array", "items": { "type": "string" } },
        "locale": { "type": "string" }
      },
      "additionalProperties": false
    },
    "confidence": { "type": "number", "minimum": 0, "maximum": 1 }
  },
  "additionalProperties": false
}
