{
  "id": "video-structure-project-1",
  "projectId": "project-1",
  "sourceVideoId": "sample-1",
  "version": "p0-v1",
  "metadata": {
    "durationSec": 30.0,
    "width": 1080,
    "height": 1920,
    "fps": 30,
    "hasAudio": true
  },
  "narrative": {
    "summary": "反问式痛点开场，中段展示实测效率与使用场景对比，结尾限时下单引导。",
    "segments": [
      {
        "id": "seg-hook",
        "role": "hook",
        "startSec": 0.0,
        "endSec": 3.0,
        "scriptSummary": "第二人称反问开场，点出「太贵又麻烦」痛点，语速偏快建立停滑。",
        "visualSummary": "9:16 胸景口播，博主直视镜头；0.8s 快切至产品 UI 特写，底部黄字关键词。",
        "intent": "停滑并建立共鸣"
      },
      {
        "id": "seg-2",
        "role": "benefit",
        "startSec": 3.0,
        "endSec": 10.5,
        "scriptSummary": "数字+结果证言，强调效率提升与使用便捷，语气由焦虑转希望。",
        "visualSummary": "中景使用演示镜头，屏幕录屏叠加三要点字幕卡片，节奏中等。",
        "intent": "建立产品价值"
      },
      {
        "id": "seg-3",
        "role": "proof",
        "startSec": 10.5,
        "endSec": 22.5,
        "scriptSummary": "前后对比式证言，展示真实场景与结果截图，增强可信度。",
        "visualSummary": "分屏对比：左旧方案卡顿、右新方案流畅；穿插用户操作近景。",
        "intent": "社会证明"
      },
      {
        "id": "seg-cta",
        "role": "cta",
        "startSec": 25.5,
        "endSec": 30.0,
        "scriptSummary": "限时优惠+明确行动指令，语速加快，制造紧迫感。",
        "visualSummary": "产品特写叠加价格贴纸与「立即购买」花字，BGM 推高。",
        "intent": "转化引导"
      }
    ]
  },
  "rhythm": {
    "totalDurationSec": 30.0,
    "shotCount": 8,
    "avgShotDurationSec": 3.75,
    "tempo": "mixed",
    "beatPoints": [
      0.0,
      1.0,
      2.1,
      3.0,
      5.0,
      8.4,
      14.0,
      22.0
    ],
    "shotBoundaries": [
      {
        "startSec": 0.0,
        "endSec": 1.0,
        "confidence": 0.8,
        "changeReason": "scene_change"
      },
      {
        "startSec": 1.0,
        "endSec": 2.1,
        "confidence": 0.81,
        "changeReason": "visual_cut"
      },
      {
        "startSec": 2.1,
        "endSec": 3.0,
        "confidence": 0.77,
        "changeReason": "visual_cut"
      },
      {
        "startSec": 3.0,
        "endSec": 5.0,
        "confidence": 0.8,
        "changeReason": "scene_change"
      },
      {
        "startSec": 5.0,
        "endSec": 8.4,
        "confidence": 0.79,
        "changeReason": "caption_change"
      },
      {
        "startSec": 8.4,
        "endSec": 14.0,
        "confidence": 0.8,
        "changeReason": "scene_change"
      },
      {
        "startSec": 14.0,
        "endSec": 22.0,
        "confidence": 0.85,
        "changeReason": "beat"
      },
      {
        "startSec": 22.0,
        "endSec": 30.0,
        "confidence": 0.84,
        "changeReason": "scene_change"
      }
    ]
  },
  "packaging": {
    "titleCards": [],
    "stickers": [],
    "transitions": [],
    "visualDensity": "low"
  },
  "slots": [
    {
      "id": "seg-hook-hook_visual-1",
      "segmentId": "seg-hook",
      "role": "hook_visual",
      "startSec": 0.0,
      "endSec": 3.0,
      "requiredAssetType": [
        "video",
        "image"
      ],
      "visualIntent": "快切胸景口播+产品 UI 特写，黄字强调痛点词",
      "scriptIntent": "反问式口播，第二人称痛点，语速快",
      "importance": "must_have",
      "constraints": []
    },
    {
      "id": "seg-hook-hook_text-2",
      "segmentId": "seg-hook",
      "role": "hook_text",
      "startSec": 0.0,
      "endSec": 3.0,
      "requiredAssetType": [
        "text",
        "packaging"
      ],
      "visualIntent": "快切胸景口播+产品 UI 特写，黄字强调痛点词",
      "scriptIntent": "反问式口播，第二人称痛点，语速快",
      "packagingHint": "highlight key message",
      "importance": "recommended",
      "constraints": []
    },
    {
      "id": "seg-2-benefit_card-1",
      "segmentId": "seg-2",
      "role": "benefit_card",
      "startSec": 3.0,
      "endSec": 10.5,
      "requiredAssetType": [
        "text",
        "packaging"
      ],
      "visualIntent": "三要点字幕卡片+中景使用演示",
      "scriptIntent": "数字证言强调效率与便捷",
      "packagingHint": "highlight key message",
      "importance": "recommended",
      "constraints": []
    },
    {
      "id": "seg-3-proof-1",
      "segmentId": "seg-3",
      "role": "proof",
      "startSec": 10.5,
      "endSec": 22.5,
      "requiredAssetType": [
        "video",
        "image",
        "text"
      ],
      "visualIntent": "分屏对比+真实操作近景",
      "scriptIntent": "前后对比证言，强调可信结果",
      "importance": "recommended",
      "constraints": []
    },
    {
      "id": "seg-cta-cta-1",
      "segmentId": "seg-cta",
      "role": "cta",
      "startSec": 25.5,
      "endSec": 30.0,
      "requiredAssetType": [
        "text",
        "packaging"
      ],
      "visualIntent": "产品特写+价格贴纸+购买花字",
      "scriptIntent": "限时优惠口播，明确下单指令",
      "packagingHint": "highlight key message",
      "importance": "must_have",
      "constraints": []
    }
  ],
  "evidence": [
    {
      "targetId": "seg-hook",
      "source": "asr",
      "summary": "0.1-2.5s 反问痛点",
      "excerpt": "太贵又麻烦？",
      "confidence": 0.8
    },
    {
      "targetId": "seg-hook",
      "source": "shot_detection",
      "summary": "3 overlapping shot boundaries at 0.0-3.0s",
      "confidence": 0.75
    },
    {
      "targetId": "seg-2",
      "source": "asr",
      "summary": "3.0-8.0s 效率证言",
      "excerpt": "效率提升，使用起来很方便",
      "confidence": 0.8
    },
    {
      "targetId": "seg-2",
      "source": "shot_detection",
      "summary": "3 overlapping shot boundaries at 3.0-10.5s",
      "confidence": 0.75
    },
    {
      "targetId": "seg-3",
      "source": "asr",
      "summary": "8.1-20.0s 场景对比",
      "excerpt": "真实使用场景和结果对比",
      "confidence": 0.8
    },
    {
      "targetId": "seg-3",
      "source": "shot_detection",
      "summary": "3 overlapping shot boundaries at 10.5-22.5s",
      "confidence": 0.75
    },
    {
      "targetId": "seg-cta",
      "source": "asr",
      "summary": "20.1-29.4s 购买引导",
      "excerpt": "点击下单了解更多",
      "confidence": 0.8
    },
    {
      "targetId": "seg-cta",
      "source": "shot_detection",
      "summary": "1 overlapping shot boundaries at 25.5-30.0s",
      "confidence": 0.75
    },
    {
      "targetId": "seg-hook-hook_visual-1",
      "source": "keyframe",
      "summary": "keyframes/shot-1.jpg",
      "confidence": 0.78
    },
    {
      "targetId": "seg-hook-hook_text-2",
      "source": "keyframe",
      "summary": "keyframes/shot-1.jpg",
      "confidence": 0.78
    },
    {
      "targetId": "seg-2-benefit_card-1",
      "source": "keyframe",
      "summary": "keyframes/shot-4.jpg,keyframes/shot-6.jpg",
      "confidence": 0.78
    }
  ],
  "confidence": 0.82
}